[
  {
    "id": "p01", "category": "linear",
    "grid": { "cols": 4, "rows": 3 },
    "inputs": [
      { "id": "S0", "state": true,  "label": "A", "cell": [0, 0] },
      { "id": "S1", "state": false, "label": "B", "cell": [0, 2] }
    ],
    "nodes": [
      { "id": "G1", "type": "OR",  "inputs": ["S0", "S1"], "cell": [1, 1] },
      { "id": "G2", "type": "NOT", "inputs": ["G1"],       "cell": [2, 1] }
    ],
    "outputs": [{ "id": "O1", "type": "lamp", "source": "G2", "cell": [3, 1] }],
    "goal": [{ "id": "O1", "value": true }]
  },
  {
    "id": "p02", "category": "linear",
    "grid": { "cols": 4, "rows": 3 },
    "inputs": [
      { "id": "S0", "state": false, "label": "A", "cell": [0, 0] },
      { "id": "S1", "state": false, "label": "B", "cell": [0, 2] }
    ],
    "nodes": [
      { "id": "G1", "type": "AND", "inputs": ["S0", "S1"], "cell": [1, 1] },
      { "id": "G2", "type": "NOT", "inputs": ["G1"],       "cell": [2, 1] }
    ],
    "outputs": [{ "id": "O1", "type": "fan", "source": "G2", "cell": [3, 1] }],
    "goal": [{ "id": "O1", "value": false }]
  },
  {
    "id": "p03", "category": "linear",
    "grid": { "cols": 4, "rows": 3 },
    "inputs": [
      { "id": "S0", "state": true,  "label": "A", "cell": [0, 0] },
      { "id": "S1", "state": true,  "label": "B", "cell": [0, 2] }
    ],
    "nodes": [
      { "id": "G1", "type": "OR",  "inputs": ["S0", "S1"], "cell": [1, 1] },
      { "id": "G2", "type": "NOT", "inputs": ["G1"],       "cell": [2, 1] }
    ],
    "outputs": [{ "id": "O1", "type": "lamp", "source": "G2", "cell": [3, 1] }],
    "goal": [{ "id": "O1", "value": true }]
  },
  {
    "id": "p04", "category": "linear",
    "grid": { "cols": 4, "rows": 3 },
    "inputs": [
      { "id": "S0", "state": true,  "label": "A", "cell": [0, 0] },
      { "id": "S1", "state": false, "label": "B", "cell": [0, 2] }
    ],
    "nodes": [
      { "id": "G1", "type": "AND", "inputs": ["S0", "S1"], "cell": [1, 1] },
      { "id": "G2", "type": "NOT", "inputs": ["G1"],       "cell": [2, 1] }
    ],
    "outputs": [{ "id": "O1", "type": "lamp", "source": "G2", "cell": [3, 1] }],
    "goal": [{ "id": "O1", "value": false }]
  },
  {
    "id": "p06", "category": "linear",
    "grid": { "cols": 4, "rows": 3 },
    "inputs": [
      { "id": "S0", "state": false, "label": "A", "cell": [0, 0] },
      { "id": "S1", "state": true,  "label": "B", "cell": [0, 2] }
    ],
    "nodes": [
      { "id": "G1", "type": "OR",  "inputs": ["S0", "S1"], "cell": [1, 1] },
      { "id": "G2", "type": "NOT", "inputs": ["G1"],       "cell": [2, 1] }
    ],
    "outputs": [{ "id": "O1", "type": "fan", "source": "G2", "cell": [3, 1] }],
    "goal": [{ "id": "O1", "value": true }]
  },
  {
    "id": "p07", "category": "linear",
    "grid": { "cols": 5, "rows": 3 },
    "inputs": [
      { "id": "S0", "state": false, "label": "A", "cell": [0, 0] },
      { "id": "S1", "state": false, "label": "B", "cell": [0, 1] },
      { "id": "S2", "state": false, "label": "C", "cell": [0, 2] }
    ],
    "nodes": [
      { "id": "G1", "type": "AND", "inputs": ["S0", "S1"], "cell": [1, 1] },
      { "id": "G2", "type": "AND", "inputs": ["G1", "S2"], "cell": [2, 1] },
      { "id": "G3", "type": "NOT", "inputs": ["G2"],       "cell": [3, 1] }
    ],
    "outputs": [{ "id": "O1", "type": "lamp", "source": "G3", "cell": [4, 1] }],
    "goal": [{ "id": "O1", "value": false }]
  },
  {
    "id": "p08", "category": "linear",
    "grid": { "cols": 5, "rows": 3 },
    "inputs": [
      { "id": "S0", "state": true,  "label": "A", "cell": [0, 0] },
      { "id": "S1", "state": false, "label": "B", "cell": [0, 1] },
      { "id": "S2", "state": false, "label": "C", "cell": [0, 2] }
    ],
    "nodes": [
      { "id": "G1", "type": "OR",  "inputs": ["S0", "S1"], "cell": [1, 1] },
      { "id": "G2", "type": "OR",  "inputs": ["G1", "S2"], "cell": [2, 1] },
      { "id": "G3", "type": "NOT", "inputs": ["G2"],       "cell": [3, 1] }
    ],
    "outputs": [{ "id": "O1", "type": "fan", "source": "G3", "cell": [4, 1] }],
    "goal": [{ "id": "O1", "value": true }]
  },
  {
    "id": "p09", "category": "linear",
    "grid": { "cols": 5, "rows": 3 },
    "inputs": [
      { "id": "S0", "state": true,  "label": "A", "cell": [0, 0] },
      { "id": "S1", "state": false, "label": "B", "cell": [0, 1] },
      { "id": "S2", "state": true,  "label": "C", "cell": [0, 2] }
    ],
    "nodes": [
      { "id": "G1", "type": "AND", "inputs": ["S0", "S1"], "cell": [1, 1] },
      { "id": "G2", "type": "AND", "inputs": ["G1", "S2"], "cell": [2, 1] },
      { "id": "G3", "type": "NOT", "inputs": ["G2"],       "cell": [3, 1] }
    ],
    "outputs": [{ "id": "O1", "type": "fan", "source": "G3", "cell": [4, 1] }],
    "goal": [{ "id": "O1", "value": false }]
  },
  {
    "id": "p10", "category": "linear",
    "grid": { "cols": 5, "rows": 3 },
    "inputs": [
      { "id": "S0", "state": false, "label": "A", "cell": [0, 0] },
      { "id": "S1", "state": false, "label": "B", "cell": [0, 1] },
      { "id": "S2", "state": true,  "label": "C", "cell": [0, 2] }
    ],
    "nodes": [
      { "id": "G1", "type": "OR",  "inputs": ["S0", "S1"], "cell": [1, 1] },
      { "id": "G2", "type": "OR",  "inputs": ["G1", "S2"], "cell": [2, 1] },
      { "id": "G3", "type": "NOT", "inputs": ["G2"],       "cell": [3, 1] }
    ],
    "outputs": [{ "id": "O1", "type": "lamp", "source": "G3", "cell": [4, 1] }],
    "goal": [{ "id": "O1", "value": true }]
  },
  {
    "id": "p11", "category": "linear",
    "grid": { "cols": 5, "rows": 3 },
    "inputs": [
      { "id": "S0", "state": true,  "label": "A", "cell": [0, 0] },
      { "id": "S1", "state": true,  "label": "B", "cell": [0, 1] },
      { "id": "S2", "state": false, "label": "C", "cell": [0, 2] }
    ],
    "nodes": [
      { "id": "G1", "type": "AND", "inputs": ["S0", "S1"], "cell": [1, 1] },
      { "id": "G2", "type": "AND", "inputs": ["G1", "S2"], "cell": [2, 1] },
      { "id": "G3", "type": "NOT", "inputs": ["G2"],       "cell": [3, 1] }
    ],
    "outputs": [{ "id": "O1", "type": "lamp", "source": "G3", "cell": [4, 1] }],
    "goal": [{ "id": "O1", "value": false }]
  },
  {
    "id": "p12", "category": "linear",
    "grid": { "cols": 5, "rows": 3 },
    "inputs": [
      { "id": "S0", "state": true,  "label": "A", "cell": [0, 0] },
      { "id": "S1", "state": true,  "label": "B", "cell": [0, 1] },
      { "id": "S2", "state": true,  "label": "C", "cell": [0, 2] }
    ],
    "nodes": [
      { "id": "G1", "type": "OR",  "inputs": ["S0", "S1"], "cell": [1, 1] },
      { "id": "G2", "type": "OR",  "inputs": ["G1", "S2"], "cell": [2, 1] },
      { "id": "G3", "type": "NOT", "inputs": ["G2"],       "cell": [3, 1] }
    ],
    "outputs": [{ "id": "O1", "type": "fan", "source": "G3", "cell": [4, 1] }],
    "goal": [{ "id": "O1", "value": true }]
  },
  {
    "id": "p13", "category": "linear",
    "grid": { "cols": 4, "rows": 3 },
    "inputs": [
      { "id": "S0", "state": true,  "label": "A", "cell": [0, 0] },
      { "id": "S1", "state": false, "label": "B", "cell": [0, 1] },
      { "id": "S2", "state": false, "label": "C", "cell": [0, 2] }
    ],
    "nodes": [
      { "id": "G1", "type": "OR",  "inputs": ["S0", "S1", "S2"], "cell": [1, 1] },
      { "id": "G2", "type": "NOT", "inputs": ["G1"],             "cell": [2, 1] }
    ],
    "outputs": [{ "id": "O1", "type": "lamp", "source": "G2", "cell": [3, 1] }],
    "goal": [{ "id": "O1", "value": true }]
  },
  {
    "id": "p14", "category": "linear",
    "grid": { "cols": 4, "rows": 3 },
    "inputs": [
      { "id": "S0", "state": true,  "label": "A", "cell": [0, 0] },
      { "id": "S1", "state": false, "label": "B", "cell": [0, 2] }
    ],
    "nodes": [
      { "id": "G1", "type": "NOT", "inputs": ["S0"],        "cell": [1, 0] },
      { "id": "G2", "type": "AND", "inputs": ["G1", "S1"],  "cell": [2, 1] }
    ],
    "outputs": [{ "id": "O1", "type": "fan", "source": "G2", "cell": [3, 1] }],
    "goal": [{ "id": "O1", "value": true }]
  },
  {
    "id": "p18", "category": "parallel",
    "grid": { "cols": 4, "rows": 4 },
    "inputs": [
      { "id": "S0", "state": false, "label": "A", "cell": [0, 0] },
      { "id": "S1", "state": false, "label": "B", "cell": [0, 2] },
      { "id": "S2", "state": true,  "label": "C", "cell": [0, 3] }
    ],
    "nodes": [
      { "id": "G1", "type": "NOT", "inputs": ["S0"],        "cell": [1, 0] },
      { "id": "G2", "type": "AND", "inputs": ["S1", "S2"],  "cell": [1, 3] },
      { "id": "G3", "type": "AND", "inputs": ["G1", "G2"],  "cell": [2, 1] }
    ],
    "outputs": [{ "id": "O1", "type": "fan", "source": "G3", "cell": [3, 1] }],
    "goal": [{ "id": "O1", "value": true }]
  },
  {
    "id": "p22", "category": "linear",
    "grid": { "cols": 3, "rows": 3 },
    "inputs": [
      { "id": "S0", "state": false, "label": "A", "cell": [0, 0] },
      { "id": "S1", "state": false, "label": "B", "cell": [0, 2] }
    ],
    "nodes": [
      { "id": "G1", "type": "XOR", "inputs": ["S0", "S1"], "cell": [1, 1] }
    ],
    "outputs": [{ "id": "O1", "type": "fan", "source": "G1", "cell": [2, 1] }],
    "goal": [{ "id": "O1", "value": true }]
  },
  {
    "id": "p23", "category": "linear",
    "grid": { "cols": 4, "rows": 3 },
    "inputs": [
      { "id": "S0", "state": true,  "label": "A", "cell": [0, 0] },
      { "id": "S1", "state": false, "label": "B", "cell": [0, 2] }
    ],
    "nodes": [
      { "id": "G1", "type": "XOR", "inputs": ["S0", "S1"], "cell": [1, 1] },
      { "id": "G2", "type": "NOT", "inputs": ["G1"],       "cell": [2, 1] }
    ],
    "outputs": [{ "id": "O1", "type": "lamp", "source": "G2", "cell": [3, 1] }],
    "goal": [{ "id": "O1", "value": true }]
  },
  {
    "id": "p24", "category": "linear",
    "grid": { "cols": 5, "rows": 3 },
    "inputs": [
      { "id": "S0", "state": true,  "label": "A", "cell": [0, 0] },
      { "id": "S1", "state": false, "label": "B", "cell": [0, 1] },